{
  "Title": "Chlorohydrin 3-MCPD in Bragg’s Liquid Aminos",
  "Url": "https://nutritionfacts.org/blog/chlorohydrin-3-mcpd-in-braggs-liquid-aminos/",
  "UpdatedAt": "2025-11-06T13:00:20+00:00",
  "Author": "Michael Greger M.D. FACLM",
  "CoverImage": {
    "Urls": [
      "https://assets.nutritionfacts.org/2025/11/2-chlorohydrin-3-mcpd-in-braggs-liquid-aminos.jpg",
      "https://assets.nutritionfacts.org/2025/11/2-chlorohydrin-3-mcpd-in-braggs-liquid-aminos-1024x576.jpg",
      "https://assets.nutritionfacts.org/2025/11/2-chlorohydrin-3-mcpd-in-braggs-liquid-aminos-720x405.jpg",
      "https://assets.nutritionfacts.org/2025/11/2-chlorohydrin-3-mcpd-in-braggs-liquid-aminos-1200x675.jpg",
      "https://assets.nutritionfacts.org/2025/11/2-chlorohydrin-3-mcpd-in-braggs-liquid-aminos-960x540.jpg",
      "https://assets.nutritionfacts.org/2025/11/2-chlorohydrin-3-mcpd-in-braggs-liquid-aminos-768x432.jpg",
      "https://assets.nutritionfacts.org/2025/11/2-chlorohydrin-3-mcpd-in-braggs-liquid-aminos-1536x864.jpg",
      "https://assets.nutritionfacts.org/2025/11/2-chlorohydrin-3-mcpd-in-braggs-liquid-aminos-480x270.jpg",
      "https://assets.nutritionfacts.org/2025/11/2-chlorohydrin-3-mcpd-in-braggs-liquid-aminos-540x304.jpg"
    ],
    "Attribution": ""
  },
  "Content": {
    "Html": "<p>Chlorohydrin contaminates hydrolyzed vegetable protein products and refined oils.</p>\n<p>In 1978, chlorohydrins were <a href=\"https://pubmed.ncbi.nlm.nih.gov/716635/\" target=\"_blank\" rel=\"noopener\">found</a> in protein hydrolysates. What does that mean? Proteins can be broken down into amino acids using a chemical process called hydrolysis, and free amino acids (like glutamate) can have taste-enhancing qualities. That’s how inexpensive soy sauce and seasonings like Bragg’s Liquid Aminos are made. This process requires high heat, high pressure, and hydrochloric acid to break apart the protein. The problem is that when any residual fat is exposed to these conditions, it can form toxic compounds called chlorohydrins, which are toxic at least to mice and rats.</p>\n<p>Chlorohydrins like 3-MCPD are <a href=\"https://pubmed.ncbi.nlm.nih.gov/25830907/\" target=\"_blank\" rel=\"noopener\">considered</a> “a worldwide problem of food chemistry,” but no long-term clinical studies on people have been reported to date. The concern is about the detrimental effects on the kidneys and fertility. In fact, there was a time 3-MCPD was <a href=\"https://pubmed.ncbi.nlm.nih.gov/21351250/\" target=\"_blank\" rel=\"noopener\">considered</a> as a potential male contraceptive because it could so affect sperm production, but research funding was withdrawn after “unacceptable side effects [were] observed in primates.” Researchers <a href=\"https://pubmed.ncbi.nlm.nih.gov/418534/\" target=\"_blank\" rel=\"noopener\">found</a> flaccid testes in rats, which is what they were going for, but it caused neurological scars in monkeys.</p>\n<p>What <a href=\"https://pubmed.ncbi.nlm.nih.gov/15093263/\" target=\"_blank\" rel=\"noopener\">do</a> you do when there are no studies in humans? How do you set some kind of safety factor? It isn’t easy, but you can take the lowest observed adverse effect level (LOAEL) in animal studies, which, <a href=\"https://pubmed.ncbi.nlm.nih.gov/32625654/\" target=\"_blank\" rel=\"noopener\">in this case</a>, was kidney damage, <a href=\"https://pubmed.ncbi.nlm.nih.gov/15093263/\" target=\"_blank\" rel=\"noopener\">add</a> in some kind of fudge factor, and then arrive at an estimated tolerable daily intake (TDI). For 3-MCPD, this means that high-level consumers of soy sauce may exceed the limit. This was <a href=\"https://ilsi.eu/publication/3-mcpd-esters-in-food-products-summary-report/\" target=\"_blank\" rel=\"noopener\">based</a> on extraordinarily high contamination levels, though. Since that study, Europe <a href=\"https://pubmed.ncbi.nlm.nih.gov/21351250/\" target=\"_blank\" rel=\"noopener\">introduced</a> a regulatory limit of 20 parts per billion (ppb) of 3-MCPD in hydrolyzed vegetable protein products like liquid aminos and soy sauce. The U.S. standards <a href=\"https://www.fda.gov/regulatory-information/search-fda-guidance-documents/cpg-sec-500500-guidance-levels-3-mcpd-3-chloro-12-propanediol-acid-hydrolyzed-protein-and-asian\" target=\"_blank\" rel=\"noopener\">are</a> much laxer, though, setting a “guidance level” of up to 50 times more, 1,000 parts per billion.</p>\n<p>I called Bragg’s to see where it fell, and the good news is that it is doing an independent, third-party analysis of its liquid aminos for 3-MCPD. The bad news is that, despite my pleas that it be fully transparent, Bragg’s wouldn’t let me share the results with you. I have seen them, though, but I’m only allowed to confirm they comfortably meet the U.S. standards but fail to meet the European standards.</p>\n<p>This is just the start of the 3-MCPD story, though. A study in Italy <a href=\"https://pubmed.ncbi.nlm.nih.gov/25862474/\" target=\"_blank\" rel=\"noopener\">tested</a> individuals’ urine for 3-MCPD or its metabolites, and 100% of the people turned up positive, confirming that it’s “a widespread food contaminant.” But 100% of people aren’t consuming soy sauce or liquid aminos every day. Remember, the chemical <a href=\"https://pubmed.ncbi.nlm.nih.gov/25830907/\" target=\"_blank\" rel=\"noopener\">results</a> from a reaction with residual vegetable oil. When vegetable oil itself is <a href=\"https://ilsi.eu/publication/3-mcpd-esters-in-food-products-summary-report/\" target=\"_blank\" rel=\"noopener\">refined</a>, when it’s deodorized and bleached, those conditions also lead to the formation of 3-MCPD.</p>\n<p>Indeed, we’ve known for years that various foods are <a href=\"https://www.researchgate.net/publication/284193508_Esters_of_3-chloropropane-12-diol_in_foodstuffs\" target=\"_blank\" rel=\"noopener\">contaminated</a>. In what kinds of foods <a href=\"https://www.bfr.bund.de/en/service/frequently-asked-questions/topic/frequently-asked-questions-regarding-the-contamination-of-foods-with-3-mcpd-2-mcpd-and-glycidyl-fatty-acid-esters/\" target=\"_blank\" rel=\"noopener\">have</a> these kinds of chemicals been detected? Well, if they’re in oils and fats, then they’re in greasy foods made from them: margarine, baked goods, pastries, deep-fried foods, fatty snacks like potato and corn chips, as well as infant formula.</p>\n<p>The U.S. Food and Drug Administration’s limit for soy sauce <a href=\"https://www.researchgate.net/publication/284193508_Esters_of_3-chloropropane-12-diol_in_foodstuffs\" target=\"_blank\" rel=\"noopener\">is</a> 1,000 ppb, but donuts can have more than 1,200 ppb, salami more than 1,500 ppb, ham nearly 3,000 ppb, and French fries in excess of 6,000 ppb, as seen here and at 4:03 in my video <strong><a href=\"https://nutritionfacts.org/video/the-side-effects-of-3-mcpd-in-braggs-liquid-aminos/\" target=\"_blank\" rel=\"noopener\">The Side Effects of 3-MCPD in Bragg’s Liquid Aminos</a></strong>.</p>\n<p><img decoding=\"async\" class=\"aligncenter size-full wp-image-116843\" src=\"https://assets.nutritionfacts.org/2025/11/4-03.png\" alt=\"\" width=\"1920\" height=\"1080\" srcset=\"https://assets.nutritionfacts.org/2025/11/4-03.png 1920w, https://assets.nutritionfacts.org/2025/11/4-03-960x540.png 960w, https://assets.nutritionfacts.org/2025/11/4-03-1024x576.png 1024w, https://assets.nutritionfacts.org/2025/11/4-03-768x432.png 768w, https://assets.nutritionfacts.org/2025/11/4-03-1536x864.png 1536w, https://assets.nutritionfacts.org/2025/11/4-03-480x270.png 480w, https://assets.nutritionfacts.org/2025/11/4-03-1200x675.png 1200w, https://assets.nutritionfacts.org/2025/11/4-03-720x405.png 720w, https://assets.nutritionfacts.org/2025/11/4-03-540x304.png 540w\" sizes=\"(max-width: 1920px) 100vw, 1920px\"/></p>\n<p>Most of us don’t <a href=\"https://pubmed.ncbi.nlm.nih.gov/26161901/\" target=\"_blank\" rel=\"noopener\">have</a> to worry about this problem, unless we’re consumers of fried food. Someone <a href=\"https://www.researchgate.net/publication/284193508_Esters_of_3-chloropropane-12-diol_in_foodstuffs\" target=\"_blank\" rel=\"noopener\">weighing</a> about 150 pounds, for example, who eats 116 grams of donuts, would exceed the European Food Safety Authority’s TDI, even if those donuts were the person’s only source of exposure. That’s about two donuts, but the same limit-blowing amount of 3-MCPD could be found in only five French fries.</p>\n<p><strong>Doctor’s Note</strong></p>\n<p>Believe me, I pleaded with the Bragg’s folks over and over. It’s curious to me that Bragg’s allowed me to talk about where its level of 3-MCPD fell compared to the standards but not say the number itself. At least it’s doing third-party testing.</p>\n<p>Learn more about this topic in my video <strong><a href=\"https://nutritionfacts.org/video/3-mcpd-in-refined-cooking-oils/\" target=\"_blank\" rel=\"noopener\">3-MCPD in Refined Cooking Oils</a></strong>.</p>\n<p>You can also check out<strong><a href=\"https://nutritionfacts.org/video/friday-favorites-the-side-effects-of-3-mcpd-in-braggs-liquid-aminos-and-refined-cooking-oils/\" target=\"_blank\" rel=\"noopener\"> Friday Favorites: The Side Effects of 3-MCPD in Bragg’s Liquid Aminos and Refined Cooking Oils</a></strong>.</p>"
  }
}
