{
  "Title": "Is Insecticidal GMO Corn Safe?",
  "Url": "https://nutritionfacts.org/blog/gmos-safe-case-bt-corn/",
  "UpdatedAt": "2016-06-28T12:00:38+00:00",
  "Author": "Michael Greger M.D. FACLM",
  "CoverImage": {
    "Urls": [
      "https://assets.nutritionfacts.org/2016/06/NF-June28-320x139.jpeg",
      "https://assets.nutritionfacts.org/2016/06/NF-June28.jpeg",
      "https://assets.nutritionfacts.org/2016/06/NF-June28-300x130.jpeg",
      "https://assets.nutritionfacts.org/2016/06/NF-June28-768x334.jpeg",
      "https://assets.nutritionfacts.org/2016/06/NF-June28-460x200.jpeg",
      "https://assets.nutritionfacts.org/2016/06/NF-June28-1024x445.jpeg"
    ],
    "Attribution": "Image Credit: Jen Wilton / Flickr. This image has been modified."
  },
  "Content": {
    "Html": "<p>Recently, the prominent science journal <em>Nature</em> <a href=\"http://www.nature.com/news/plan-for-the-future-1.12896\" target=\"_blank\" rel=\"noopener\">editorialized</a> that we are now swimming in information about genetically modified crops, but that much of the information is wrong—on both sides of the debate. “But a lot of this incorrect information is sophisticated, backed by legitimate-sounding research and written with certitude,” <a href=\"http://www.nature.com/news/plan-for-the-future-1.12896\">add</a><a href=\"http://www.nature.com/news/plan-for-the-future-1.12896\" target=\"_blank\" rel=\"noopener\">ing</a> that with GMOs, “a good gauge of a statement’s fallacy is the conviction with which it is delivered.”</p>\n<p>To many in the scientific community, GMO concerns are dismissed as one big conspiracy theory. In fact, one item in a psychological test of belief in conspiracy theories <a href=\"http://www.ncbi.nlm.nih.gov/pubmed/23818886\" target=\"_blank\" rel=\"noopener\">asked</a> people if they thought food companies would have the audacity to be dishonest about genetically modified food. The study concluded that many people were cynical and skeptical with regard to advertising tricks, as well as the tactics of organizations like banks and alcohol, drug, and tobacco companies. That doesn’t sound like conspiracy theory to me; that sounds like business as usual.</p>\n<p>We must remember there is a long <a href=\"http://www.ncbi.nlm.nih.gov/pubmed/23308036\" target=\"_blank\" rel=\"noopener\">legacy</a> of scientific misconduct. Throw in a multi-billion dollar industry, and one can imagine how <a href=\"http://www.ifpri.org/publication/measuring-economic-impacts-transgenic-crops-developing-agriculture-during-first-decade\" target=\"_blank\" rel=\"noopener\">hard it is to get to the truth of the matter</a>. There are social, environmental, economic, food security, and biodiversity arguments both pro and con about GMOs, but those are outside my area of expertise. I’m going to stick to food safety. And as a physician, I’m a very limited veterinarian—I only know one species (us!). So, I will skip the lab animal data and ask instead: What human data do we have about GMO safety?</p>\n<p>One study “<a href=\"http://www.ncbi.nlm.nih.gov/pubmed/23936105\">confirm</a><a href=\"http://www.ncbi.nlm.nih.gov/pubmed/23936105\">ed</a>” that DNA from genetically modified crops can be transferred into humans who eat them, but that’s not what the study found, just that plant DNA in general may be found in the human bloodstream, with no stipulations of harm (See <strong><a title=\"Are GMOs Safe? The Case of Bt Corn\" href=\"https://nutritionfacts.org/video/are-gmos-safe-the-case-of-bt-corn/\" rel=\"bookmark\">Are GMOs Safe? The Case of Bt Corn</a></strong>).</p>\n<p>Another study, however, did <a href=\"http://www.ncbi.nlm.nih.gov/pubmed/21338670\" target=\"_blank\" rel=\"noopener\">find</a> a GMO crop protein in people. The “toxin” was detected in 93 percent of blood samples of pregnant women, 80 percent of umbilical cord blood samples, and 69 percent of samples from non-pregnant women. The toxin they’re talking about is an insecticidal protein produced by Bt bacteria whose gene was inserted into the corn’s DNA to create so-called Bt-corn, which has been incorporated into animal feed. If it’s mainly in animal feed, how did it get into the bodies of women? They suggest it may be through exposure to contaminated meat.</p>\n<p>Of course, why get GMO’s second-hand when you can get them directly? The next great frontier is <a href=\"http://www.ncbi.nlm.nih.gov/pubmed/22361646\" target=\"_blank\" rel=\"noopener\">transgenic farm animals</a>. A <a href=\"http://www.ncbi.nlm.nih.gov/pubmed/21276930\" target=\"_blank\" rel=\"noopener\">genetically modified salmon</a> was first to vie for a spot at the dinner table. And then in 2010, transgenic cows, sheep, goats and pigs were <a href=\"http://www.nature.com/news/politics-holds-back-animal-engineers-1.11596?WT.ec_id=NATUREjobs-20121018\" target=\"_blank\" rel=\"noopener\">created</a>, genetically modified for increased muscle mass, based on the so-called <a href=\"http://www.ncbi.nlm.nih.gov/pubmed/9139826\" target=\"_blank\" rel=\"noopener\">mighty mouse model</a>. Frankenfurters!</p>\n<p>But back to children of the corn and their mothers. When they say it’s a toxin, it’s a toxin to corn worms, not necessarily to people. In fact I couldn’t find any data linking BT toxin to human harm, which is a good thing since it’s considered one of the few pesticides considered so non-toxic that it’s sprayed on organic fruits and vegetables.</p>\n<p>For more on on the public health implications of genetically modified crops, see:</p>\n<ul>\n<li><strong><a href=\"https://nutritionfacts.org/video/are-gmos-safe-the-case-of-roundup-ready-soy/\" target=\"_blank\" rel=\"noopener\">Are GMOs Safe? The Case of Roundup Ready Soy</a></strong></li>\n<li><strong><a href=\"https://nutritionfacts.org/video/is-monsantos-roundup-pesticide-glyphosate-safe/\" target=\"_blank\" rel=\"noopener\">Is Monsanto’s Roundup Pesticide Glyphosate Safe?</a></strong></li>\n<li><strong><a href=\"https://nutritionfacts.org/video/gmo-soy-and-breast-cancer/\" target=\"_blank\" rel=\"noopener\">GMO Soy and Breast Cancer</a></strong></li>\n</ul>\n<p>I did a similar “controversial issue” video series on gluten. See:</p>\n<ul>\n<li><strong><a href=\"https://nutritionfacts.org/video/is-gluten-sensitivity-real/\">Is Gluten Sensitivity Real?</a></strong></li>\n<li><strong><a href=\"https://nutritionfacts.org/video/gluten-free-diets-separating-the-wheat-from-the-chat/\">Gluten-Free Diets: Separating the Wheat from the Chat</a></strong></li>\n<li><strong><a href=\"https://nutritionfacts.org/video/how-to-diagnose-gluten-intolerance/\">How to Diagnose Gluten Intolerance</a></strong></li>\n</ul>\n<p>For those interested in the genetic engineering of livestock, I published a few papers myself on the topic:</p>\n<ul>\n<li><a href=\"http://www.drgreger.org/Greger_2011_CAB.pdf\">Centre for Agriculture and Biosciences (CAB) Reviews 6(41):1-6.</a></li>\n<li><a href=\"http://www.springerlink.com/content/p811p18540937037/?p=56600355cd164d5590ad163e1ae6430b&amp;pi=1\">Journal of Agricultural and Environmental Ethics 24(5):451-472.</a></li>\n<li><a href=\"http://www.journalofanimalscience.org/content/88/2/811.full\"> Journal of Animal Science 88(2):811-4.</a></li>\n</ul>\n<div>\n<p>In health,<b><br/>Michael Greger, M.D.</b></p>\n<p>PS: If you haven’t yet, you can subscribe to my free videos <a href=\"http://www.nutritionfacts.us5.list-manage.com/subscribe?u=c1bae6687e1e6ab175fb56913&amp;id=40f9e497d1\"><u>here</u></a> and watch my live year-in-review presentations <a href=\"https://nutritionfacts.org/video/uprooting-the-leading-causes-of-death/\"><u><b>Uprooting the Leading Causes of Death</b></u></a>,<b> </b><a href=\"https://nutritionfacts.org/video/more-than-an-apple-a-day-preventing-our-most-common-diseases/\"><u><b>More Than an Apple a Day</b></u></a>,<b> </b><a href=\"https://nutritionfacts.org/video/from-table-to-able/\"><u><b>From Table to Able</b></u></a>, and<b> </b><a href=\"https://nutritionfacts.org/video/food-as-medicine/\"><u><b>Food as Medicine</b></u></a>.</p>\n</div>"
  }
}
