{
  "Title": "How to Get Our Kids to Eat Their Vegetables",
  "Url": "https://nutritionfacts.org/blog/how-to-get-our-kids-to-eat-their-vegetables/",
  "UpdatedAt": "2014-06-17T12:00:36+00:00",
  "Author": "Michael Greger M.D. FACLM",
  "CoverImage": {
    "Urls": [
      "https://assets.nutritionfacts.org/2014/06/NF-June17-Tricks-to-Get-Kids-to-Eat-Healthier-at-Home-460x200.jpg",
      "https://assets.nutritionfacts.org/2014/06/NF-June17-Tricks-to-Get-Kids-to-Eat-Healthier-at-Home-800x347.jpg",
      "https://assets.nutritionfacts.org/2014/06/NF-June17-Tricks-to-Get-Kids-to-Eat-Healthier-at-Home-1024x444.jpg",
      "https://assets.nutritionfacts.org/2014/06/NF-June17-Tricks-to-Get-Kids-to-Eat-Healthier-at-Home-768x333.jpg",
      "https://assets.nutritionfacts.org/2014/06/NF-June17-Tricks-to-Get-Kids-to-Eat-Healthier-at-Home-320x138.jpg",
      "https://assets.nutritionfacts.org/2014/06/NF-June17-Tricks-to-Get-Kids-to-Eat-Healthier-at-Home.jpg",
      "https://assets.nutritionfacts.org/2014/06/NF-June17-Tricks-to-Get-Kids-to-Eat-Healthier-at-Home-300x130.jpg"
    ],
    "Attribution": "Image Credit: U.S. Department of Agriculture / Flickr.  This image has been modified."
  },
  "Content": {
    "Html": "<p>When researchers offered kids broccoli or a chocolate bar, which do you think they <a href=\"http://connection.ebscohost.com/c/articles/77547340/p136-do-spokes-characters-improve-consumption-vegetables-among-children\" target=\"_blank\">picked</a>? Four out of five picked the chocolate (though how proud are the parents of the one in five kids that chose the broccoli?!).</p>\n<p>But what if we put an Elmo sticker on the broccoli? When an Elmo sticker was placed on the broccoli, it was half and half. Fifty percent chose the broccoli.</p>\n<p>It works in schools, too. A picture of SpongeBob saying, “Got beans?” and 37% more boys and 17% more girls chose green beans. One little sign and kids were eating significantly more vegetables.</p>\n<p>We saw how we should <a href=\"http://www.ncbi.nlm.nih.gov/pubmed/22391143\" target=\"_blank\">cut up</a> (or cut out) cookies to minimize consumption in my video <strong><a href=\"https://nutritionfacts.org/video/tricks-to-get-kids-to-eat-healthier-at-school/\" target=\"_blank\" data-ls-seen=\"1\">Tricks to Get Kids to Eat Healthier at School</a></strong>. How should we cut up vegetables to <em>maximize</em> consumption? Which do you think 9 to 12 year olds <a href=\"http://www.ncbi.nlm.nih.gov/pubmed/22796947\" target=\"_blank\">ate</a> more of, whole slices, sticks or stars? And do they like them bigger, or smaller? The results were strikingly clear. Turns out “Shape was very influential; children clearly preferred having their vegetables cut.” Stars were liked the most. What about whole slices versus sticks? No difference. It turns out that size only mattered for the whole chunk: the ordinary size was preferred to the miniature versions.</p>\n<p>If they’re still not biting, we can <a href=\"http://www.ncbi.nlm.nih.gov/pubmed/22027046\" target=\"_blank\">apply</a> the same trick I use to get our dog to eat stuff she doesn’t like: dip it in peanut butter. “Pairing vegetables with peanut butter may successfully increase intake, even in vegetable-resistant children.” <a href=\"http://www.ncbi.nlm.nih.gov/pubmed/22741167\" target=\"_blank\">Offering</a> a salad dressing dip may help, too.</p>\n<p>Then there’s always the hidden vegetables strategy.  In one <a href=\"http://www.ncbi.nlm.nih.gov/pubmed/21775554\" target=\"_blank\">study</a>, “broccoli, cauliflower, tomatoes, squash, and zucchini were covertly added to familiar entrees so that the appearance, flavor, and texture of the original recipes were maintained,” like pureeing vegetables into a pasta sauce, and families weren’t any wiser. Covertly incorporating vegetables into foods can “have a beneficial effect on children’s vegetable intake, but it should not be the only way that vegetables are served to children.”  Since the appetite for an initially unappetizing vegetable can be increased through repeated exposure, it is important to use several strategies to ensure that children experience different forms of vegetables, especially whole vegetables, because they’re not always going to be at home.</p>\n<p>Worse comes to worst, public health advocates can make a video game. There’s a public/private partnership, “<a href=\"http://www.ncbi.nlm.nih.gov/pubmed/22771184\" target=\"_blank\" data-ls-seen=\"1\">The Quest to Lava Mountain</a>,” where you can apparently harvest kale and gain “knowledge about the health benefits of eating healthy foods such as fruits, vegetables, and whole-grain foods” as well as the detrimental effects of eating junk. Where were the kale video games when I was growing up?</p>\n<p>What may be the best way, though, to get kids to eat more fruits and vegetables? One <a href=\"http://www.ncbi.nlm.nih.gov/pubmed/20849895\" target=\"_blank\" data-ls-seen=\"1\">study</a>, featured in my video <a href=\"https://nutritionfacts.org/video/tricks-to-get-kids-to-eat-healthier-at-home/\" target=\"_blank\"><strong>Tricks to Get Kids to Eat Healthier at Home</strong></a>, looked at all sorts of parenting styles—should we pressure them or should we lay off? What was the most important factor? The most important predictor of children’s fruit consumption was… <em>the parent</em>‘<em>s consumption</em>. That was pretty much the case with vegetables, too. If we want our kids to eat healthy, we have to model healthy behavior. The researchers concluded that in order to try to increase children’s fruit and vegetable consumption, parents should be guided to improve their own diets first.</p>\n<p>For a smattering of other videos on children’s health, check out:</p>\n<ul>\n<li><strong><a title=\"Video: Nerves of Mercury\" href=\"https://nutritionfacts.org/video/nerves-of-mercury/\" target=\"_blank\" data-ls-seen=\"1\">Nerves of Mercury</a></strong></li>\n<li><strong><a title=\"Video: Doctors’ Nutritional Ignorance\" href=\"https://nutritionfacts.org/video/doctors-nutritional-ignorance/\" target=\"_blank\" data-ls-seen=\"1\">Doctors’ Nutritional Ignorance</a></strong></li>\n<li><strong><a title=\"Video: Protein, Puberty, and Pollutants\" href=\"https://nutritionfacts.org/video/protein-puberty-and-pollutants/\" target=\"_blank\" data-ls-seen=\"1\">Protein, Puberty, and Pollutants</a></strong></li>\n<li><strong><a title=\"Video: How Fast Can Children Detoxify from PCBs?\" href=\"https://nutritionfacts.org/video/how-fast-can-children-detoxify-from-pcbs/\" target=\"_blank\" data-ls-seen=\"1\">How Fast Can Children Detoxify from PCBs?</a></strong></li>\n<li><strong><a title=\"Video: Does a Drink Of Water Make Children Smarter?\" href=\"https://nutritionfacts.org/video/does-a-drink-of-water-make-children-smarter/\" target=\"_blank\" data-ls-seen=\"1\">Does a Drink of Water Make Children Smarter?</a></strong></li>\n<li><strong><a title=\"Video: Are Cats or Dogs More Protective For Children’s Health?\" href=\"https://nutritionfacts.org/video/are-cats-or-dogs-more-protective-for-childrens-health/\" target=\"_blank\" data-ls-seen=\"1\">Are Cats or Dogs More Protective For Children’s Health?</a></strong></li>\n</ul>\n<p>I cover grown-ups in <strong><a href=\"https://nutritionfacts.org/video/tricks-to-get-adults-to-eat-healthier/\" target=\"_blank\" data-ls-seen=\"1\">Tricks to Get Adults to Eat Healthier</a></strong>.<strong></strong></p>\n<p><strong>-Michael Greger, M.D.</strong></p>\n<p>PS: If you haven’t yet, you can subscribe to my videos for free by <a href=\"https://nutritionfacts.us5.list-manage.com/subscribe?u=c1bae6687e1e6ab175fb56913&amp;id=40f9e497d1\" target=\"_blank\"><strong>clicking here</strong></a> and watch my full 2012 – 2015 presentations <strong><a href=\"https://nutritionfacts.org/video/uprooting-the-leading-causes-of-death/\" target=\"_blank\">Uprooting the Leading Causes of Death</a></strong><a href=\"https://nutritionfacts.org/video/uprooting-the-leading-causes-of-death/\" target=\"_blank\"></a>, <strong><a href=\"https://nutritionfacts.org/video/more-than-an-apple-a-day-preventing-our-most-common-diseases/\">More than an Apple a Day</a></strong>, <strong><a href=\"https://nutritionfacts.org/video/from-table-to-able/\">From Table to Able</a></strong>, and <strong><a href=\"https://nutritionfacts.org/video/food-as-medicine/\">Food as Medicine</a></strong>.</p>"
  }
}
