{
  "Title": "How to Maximize Nutrient Absorption",
  "Url": "https://nutritionfacts.org/blog/how-to-maximize-nutrient-absorption/",
  "UpdatedAt": "2017-11-14T13:00:58+00:00",
  "Author": "Michael Greger M.D. FACLM",
  "CoverImage": {
    "Urls": [
      "https://assets.nutritionfacts.org/2017/11/11-28-Downside-of-Green-960x540.jpeg",
      "https://assets.nutritionfacts.org/2017/11/11-28-Downside-of-Green-1024x576.jpeg",
      "https://assets.nutritionfacts.org/2017/11/11-28-Downside-of-Green-720x405.jpeg",
      "https://assets.nutritionfacts.org/2017/11/11-28-Downside-of-Green-356x200.jpeg",
      "https://assets.nutritionfacts.org/2017/11/11-28-Downside-of-Green-768x432.jpeg",
      "https://assets.nutritionfacts.org/2017/11/11-28-Downside-of-Green-540x304.jpeg",
      "https://assets.nutritionfacts.org/2017/11/11-28-Downside-of-Green-928x522.jpeg",
      "https://assets.nutritionfacts.org/2017/11/11-28-Downside-of-Green.jpeg",
      "https://assets.nutritionfacts.org/2017/11/11-28-Downside-of-Green-1200x675.jpeg"
    ],
    "Attribution": "Image Credit: MaxPixel. This image has been modified."
  },
  "Content": {
    "Html": "<p>Unhealthy lifestyle behaviors associated with an <a href=\"http://www.ncbi.nlm.nih.gov/pubmed/20631456\">increased</a> risk of premature death include smoking, excessive alcohol drinking, and not eating enough greens. The best way to get your greens is in whichever way you’ll eat the most of them, and one way to sneak extra greens into your daily diet is with whole-food smoothies, “a potent blend of good nutrition” in a quick, portable, delicious form.  </p>\n<p>The Mayo Clinic offers a basic green smoothie recipe, combining the healthiest of fruits and the healthiest of vegetables, berries and dark green leafies, respectively. It calls for 2 ounces of baby spinach, which is about a cup and a half. Consider adding in some curly parsley, another mild beginner green to start with. Surprisingly, the sweetness of the fruit masks any bitterness from the greens such that the pickiest of children love these smoothies, as do adults who otherwise would not consume dark green leafy vegetables—or even fruit—for breakfast. Indeed, the average teen may only <a href=\"http://www.ncbi.nlm.nih.gov/pubmed/25588935\">get</a> about 1/20th of a serving of fruit otherwise—and <i>Froot</i><i> L</i><i>oops</i> don’t count. </p>\n<p>Offering smoothies can have a dramatic effect on fruit consumption for “students who do not want to take time peeling or chewing fruits.” (Who doesn’t have time to chew a fruit?!) The milkshake-y texture of smoothies may not only boost the quantity of fruit and vegetable consumption, but also the quality. </p>\n<p>Carotenoid phytonutrients, like beta-carotene and lycopene, can exist as microscopic crystals <a href=\"http://www.ncbi.nlm.nih.gov/pubmed/22980866\">trapped</a> inside the cell walls of fruits and vegetables. They’re only <a href=\"http://www.ncbi.nlm.nih.gov/pubmed/21535705\">released</a> when the cells are disrupted, which is why we have to chew really well. We either have to chew <a href=\"http://www.ncbi.nlm.nih.gov/pubmed/22806183\">better</a> or choose plants that are easier to chew. For example, while tomatoes have more beta-carotene than watermelon does, watermelon’s beta-carotene is more bioaccessible because its cell walls are wimpy compared with the smaller and tougher cell walls of other fruits and vegetables. To maximize nutrient release, food particle size would ideally be <a href=\"http://www.ncbi.nlm.nih.gov/pubmed/23157717\">reduced</a> to smaller than the width of the individual plant cells, but you can’t do that with chewing. Most vegetable particles end up <a href=\"http://www.ncbi.nlm.nih.gov/pubmed/15218050\">greater</a> than two millimeters when you chew them, whereas if we broke open all the cells, we could release much <a href=\"http://www.ncbi.nlm.nih.gov/pubmed/21121612\">more</a> nutrition, as you can see in my video, <a href=\"https://nutritionfacts.org/video/are-green-smoothies-good-for-you/\"><b>Are Green Smoothies Good for You?</b></a>. The particle size distribution from chewing is about what you’d get blending in a food processor for about five seconds or one of those high-speed blenders for maybe half a second. Just 40 seconds in a blender can <a href=\"http://www.ncbi.nlm.nih.gov/pubmed/14584601\">break</a> down spinach to a subcellular level. </p>\n<p>Why does that matter? Let’s look at folate, the B vitamin in greens that is especially important for women of child-bearing age. Feed people a cup of spinach a day for three weeks and their folate goes up compared to <a href=\"http://www.ncbi.nlm.nih.gov/pubmed/11111131\">control</a>. What happens if you eat finely chopped spinach instead of whole leaves? You end up with more than twice as much in your bloodstream and the same absorption-boosting effect with lutein, the green nutrient so important for our eyesight.</p>\n<p>It’s not what you eat—it’s what you absorb.  </p>\n<p>The <a href=\"http://www.ncbi.nlm.nih.gov/pubmed/10655967\">boost</a> for lutein was only 14%; so, a few extra bites of the whole leafy greens would have given you just as much. Some other nutrients, such as vitamin C, aren’t affected by pre-chopping at all. This is also less of an issue with cooked vegetables. If you boil carrots for three minutes, regular chewing can release about ten times more beta-carotene bioaccessibility than eating them raw, but not as much as <a href=\"http://www.ncbi.nlm.nih.gov/pubmed/21121612\">blended</a>. Intense cooking, like boiling for 25 minutes, damages the cell walls so even gulping down large particles can result in significant absorption. But, blending may double carotenoid availability, explaining why we may be able to <a href=\"http://www.ncbi.nlm.nih.gov/pubmed/11823572\">absorb</a> three times the alpha- and beta-carotene from pureed cooked carrots compared to mashed cooked carrots. So, blending vegetables—raw or cooked—into soups, sauces, or smoothies can maximize nutrient absorption. Whether you went to the store and bought it, or toiled in your garden to grow it, you might as well take full advantage of it.  </p>\n<hr/>\n<p>Check out my other videos that touch on smoothies:</p>\n<ul>\n<li><strong><a href=\"https://nutritionfacts.org/video/are-green-smoothies-bad-for-you/\">Are Green Smoothies Bad for You?</a></strong> </li>\n<li><a href=\"https://nutritionfacts.org/video/the-downside-of-green-smoothies/\"><strong>The Downside of Green Smoothies</strong></a> </li>\n<li><a href=\"https://nutritionfacts.org/video/a-better-breakfast/\"><strong>A Better Breakfast</strong></a></li>\n<li><a href=\"https://nutritionfacts.org/video/juicing-removes-more-than-just-fiber/\"><strong>Juicing Removes More Than Just Fiber</strong></a></li>\n</ul>\n<p>For other tips on getting children of all ages to eat healthier, see <a href=\"https://nutritionfacts.org/video/tricks-to-get-kids-to-eat-healthier-at-home/\"><strong>Tricks to Get Kids to Eat Healthier at Home</strong></a> and <a href=\"https://nutritionfacts.org/video/tricks-to-get-adults-to-eat-healthier/\"><strong>Tricks to Get Adults to Eat Healthier</strong></a>.</p>\n<p>Finally, learn more about the effect of cooking on nutrient loss and absorption from these videos: <a href=\"https://nutritionfacts.org/video/best-cooking-method/\"><strong>Best Cooking Method</strong></a>, <a href=\"https://nutritionfacts.org/video/raw-food-nutrient-absorption-3/\"><strong>Raw Food Nutrient Absorption</strong></a>, and <a href=\"https://nutritionfacts.org/video/sometimes-the-enzyme-myth-is-true/\"><strong>Sometimes the Enzyme Myth Is True</strong></a>.</p>\n<p>In health,<br/>\n <strong>Michael Greger, M.D.</strong></p>\n<p> PS: If you haven’t yet, you can subscribe to my free videos <a href=\"http://www.nutritionfacts.us5.list-manage.com/subscribe?u=c1bae6687e1e6ab175fb56913&amp;id=40f9e497d1\"><strong>here</strong></a><strong> </strong>and watch my live, year-in-review presentations:</p>\n<ul>\n<li>2012: <a href=\"https://nutritionfacts.org/video/uprooting-the-leading-causes-of-death/\"><strong>Uprooting the Leading Causes of Death</strong></a></li>\n<li>2013: <a href=\"https://nutritionfacts.org/video/more-than-an-apple-a-day-preventing-our-most-common-diseases/\"><strong>More Than an Apple a Day</strong></a></li>\n<li>2014: <a href=\"https://nutritionfacts.org/video/from-table-to-able/\"><strong>From Table to Able: Combating Disabling Diseases with Food</strong></a></li>\n<li>2015: <a href=\"https://nutritionfacts.org/video/food-as-medicine/\"><strong>Food as Medicine: Preventing and Treating the Most Dreaded Diseases with Diet</strong></a></li>\n<li>2016: <a href=\"https://nutritionfacts.org/video/how-not-to-die/\"><strong>How Not To Die: The Role of Diet in Preventing, Arresting, and Reversing Our Top 15 Killers</strong></a></li>\n</ul>"
  }
}
