{
  "Title": "Which Nut Suppresses Cancer Cell Growth the Most?",
  "Url": "https://nutritionfacts.org/blog/which-nut-suppresses-cancer-cell-growth-the-most/",
  "UpdatedAt": "2015-12-22T13:00:14+00:00",
  "Author": "Michael Greger M.D. FACLM",
  "CoverImage": {
    "Urls": [
      "https://assets.nutritionfacts.org/2015/12/NF-Dec15-Which-Nut-Fights-Cancer-Better-768x334.jpg",
      "https://assets.nutritionfacts.org/2015/12/NF-Dec15-Which-Nut-Fights-Cancer-Better-320x139.jpg",
      "https://assets.nutritionfacts.org/2015/12/NF-Dec15-Which-Nut-Fights-Cancer-Better.jpg",
      "https://assets.nutritionfacts.org/2015/12/NF-Dec15-Which-Nut-Fights-Cancer-Better-300x130.jpg",
      "https://assets.nutritionfacts.org/2015/12/NF-Dec15-Which-Nut-Fights-Cancer-Better-460x200.jpg",
      "https://assets.nutritionfacts.org/2015/12/NF-Dec15-Which-Nut-Fights-Cancer-Better-1024x445.jpg"
    ],
    "Attribution": "Image Credit: Mariya Chorna / Flickr.  This image has been modified."
  },
  "Content": {
    "Html": "<p>People who eat nuts in their adolescence may have a better chance of fighting off breast cancer later in life, according to data from the <a href=\"http://www.ncbi.nlm.nih.gov/pubmed/20229245\" target=\"_blank\" rel=\"noopener\">Harvard Nurse’s Study</a>. A <a href=\"http://www.ncbi.nlm.nih.gov/pubmed/24043428\" target=\"_blank\" rel=\"noopener\">follow-up study</a> involving the daughters of the nurses corroborated the findings. Those eating more peanut butter, nuts, beans, lentils, soybeans, or corn were found to have just a fraction of the risk for fibrocystic breast disease, which places one at higher risk of cancer. The protective effects were found to be strongest for those most at risk, such as those with a family history of breast cancer.</p>\n<p>Another<a href=\"http://www.ncbi.nlm.nih.gov/pubmed/24149179\" target=\"_blank\" rel=\"noopener\"> study</a> out of the <em>British Journal of Cancer</em> found that even two handfuls of nuts a week may protect against pancreatic cancer, one of our most fatal malignancies.</p>\n<p>Nuts are <a href=\"http://www.ncbi.nlm.nih.gov/pubmed/24176559\" target=\"_blank\" rel=\"noopener\">described</a> as “nutritionally precious,” which may explain some of the mechanisms by which nut components induce cancer cell death and inhibit cancer growth and spread <em>in vitro</em>. But which nuts work the best? In terms of antioxidant content, walnuts and pecans steal the show. Twenty-five walnuts <a href=\"http://www.sciencedirect.com/science/article/pii/S0023643808001771\" target=\"_blank\" rel=\"noopener\">have</a> the antioxidant equivalent of eight grams of vitamin C (the vitamin C found in a hundred oranges).</p>\n<p>But how do they do against cancer? In the video, <a href=\"https://nutritionfacts.org/video/which-nut-fights-cancer-better/\"><strong>Which Nut Fights Cancer Better?</strong></a>, you can see a <a href=\"http://www.sciencedirect.com/science/article/pii/S0023643808001771\" target=\"_blank\" rel=\"noopener\">graph</a> of human cancer cell proliferation versus increasing concentrations of the ten most common nuts eaten in the United States. If you drip water on these cancer cells as a control, nothing happens. Hazelnuts, pistachios and Brazil nuts don’t do much better. Pine nuts, cashews and macadamias start pulling away from the pack. Almonds appear twice as protective, halving cancer cell growth at only half the dose as pine nuts, cashews, and macadamias. Walnuts, pecans, and peanuts come out as the clear winners, causing a dramatic drop in cancer proliferation at just tiny doses.</p>\n<p>More nuttiness:</p>\n<ul>\n<li><strong><a href=\"https://nutritionfacts.org/video/fighting-inflammation-in-a-nut-shell/\" target=\"_blank\" rel=\"noopener\">Fighting Inflammation in a Nut Shell</a></strong></li>\n<li><strong><a href=\"https://nutritionfacts.org/video/tree-nuts-or-peanuts-for-breast-cancer-prevention/\" target=\"_blank\" rel=\"noopener\">Tree Nuts or Peanuts for Breast Cancer Prevention?</a></strong></li>\n<li><strong><a href=\"https://nutritionfacts.org/video/how-do-nuts-prevent-sudden-cardiac-death/\" target=\"_blank\" rel=\"noopener\">How Do Nuts Prevent Sudden Cardiac Death?</a></strong></li>\n<li><strong><a href=\"https://nutritionfacts.org/video/nuts-and-bolts-of-cholesterol-lowering/\" target=\"_blank\" rel=\"noopener\">Nuts and Bolts of Cholesterol Lowering</a></strong></li>\n<li><strong><a href=\"https://nutritionfacts.org/video/nuts-and-obesity-the-weight-of-evidence/\" target=\"_blank\" rel=\"noopener\">Nuts and Obesity: The Weight of Evidence</a></strong></li>\n<li><strong><a href=\"https://nutritionfacts.org/video/nuts-may-help-prevent-death/\" target=\"_blank\" rel=\"noopener\">Nuts May Help Prevent Death</a></strong></li>\n<li><strong><a href=\"https://nutritionfacts.org/video/walnuts-and-artery-function/\" target=\"_blank\" rel=\"noopener\">Walnuts and Artery Function</a></strong></li>\n<li><strong><a href=\"https://nutritionfacts.org/video/Four-Nuts-Once-a-Month/\">Four Nuts Once a Month</a></strong></li>\n</ul>\n<p><b>-Michael Greger, M.D.</b></p>\n<p>PS: If you haven’t yet, you can subscribe to my free videos <a href=\"http://www.nutritionfacts.us5.list-manage.com/subscribe?u=c1bae6687e1e6ab175fb56913&amp;id=40f9e497d1\"><span style=\"text-decoration: underline;\"><b>here</b></span></a> and watch my live year-in-review presentations <a href=\"https://nutritionfacts.org/video/uprooting-the-leading-causes-of-death/\"><span style=\"text-decoration: underline;\"><b>Uprooting the Leading Causes of Death</b></span></a>, <a href=\"https://nutritionfacts.org/video/more-than-an-apple-a-day-preventing-our-most-common-diseases/\"><span style=\"text-decoration: underline;\"><b>More Than an Apple a Day</b></span></a>, <a href=\"https://nutritionfacts.org/video/from-table-to-able/\"><span style=\"text-decoration: underline;\"><b>From Table to Able</b></span></a>, and <a href=\"https://nutritionfacts.org/video/food-as-medicine/\"><b>Food as Medicine</b></a>.</p>"
  }
}
