{
  "Title": "Dr. Greger Takes on Mediterranean Diet in New DVD",
  "Url": "https://nutritionfacts.org/blog/dr-greger-takes-on-mediterranean-diet-in-new-dvd/",
  "UpdatedAt": "2015-01-29T13:00:43+00:00",
  "Author": "Michael Greger M.D. FACLM",
  "CoverImage": {
    "Urls": [
      "https://assets.nutritionfacts.org/2015/01/Volume-23-Feature-Image.png",
      "https://assets.nutritionfacts.org/2015/01/Volume-23-Feature-Image-300x192.png",
      "https://assets.nutritionfacts.org/2015/01/Volume-23-Feature-Image-312x200.png",
      "https://assets.nutritionfacts.org/2015/01/Volume-23-Feature-Image-1024x655.png",
      "https://assets.nutritionfacts.org/2015/01/Volume-23-Feature-Image-768x491.png",
      "https://assets.nutritionfacts.org/2015/01/Volume-23-Feature-Image-320x204.png"
    ],
    "Attribution": ""
  },
  "Content": {
    "Html": "<p>The Mediterranean Diet is an “in” topic nowadays, in both the medical literature and the lay media. More than 450 papers were published in the medical literature during just the last year alone, more than one a day. As a recent commentary noted “Uncritical laudatory coverage is the common parlance. Specifics are hard to come by: what is it? what is its history? why is it good? Merits are rarely detailed; possible downsides are never mentioned.” I answer these questions and more in a 6-part video series:</p>\n<ul>\n<li value=\"11\">Why Was Heart Disease Rare in the Mediterranean?</li>\n<li value=\"12\">The Mediterranean Diet or a Whole Food Plant-Based Diet?</li>\n<li value=\"13\">PREDIMED: Does Eating Nuts Prevent Strokes?</li>\n<li value=\"14\">Which Parts of the Mediterranean Diet Extended Life?</li>\n<li value=\"15\">Do Flexitarians Live Longer?</li>\n<li value=\"16\">Improving on the Mediterranean Diet</li>\n</ul>\n<p>They are all available right now as a <a style=\"color: #339900; font-weight: normal; text-decoration: underline;\" href=\"http://www.drgreger.org/downloads\" target=\"_blank\" rel=\"noopener\">video download</a> as part of my new <em>Latest in Clinical Nutrition</em> volume 23 (all proceeds go to this charity). It can also be ordered as a <a style=\"color: #339900; font-weight: normal; text-decoration: underline;\" href=\"http://www.drgreger.org/dvds\" target=\"_blank\" rel=\"noopener\">physical DVD</a>. The Mediterranean videos are all scheduled to go up on NutritionFacts.org by mid-March, but you can download and watch them <a style=\"color: #339900; font-weight: normal; text-decoration: underline;\" href=\"http://www.drgreger.org/downloads\" target=\"_blank\" rel=\"noopener\">right now</a>.</p>\n<p>The current batch of videos from <a style=\"color: #339900; font-weight: normal; text-decoration: underline;\" href=\"https://nutritionfacts.org/blog/dr-greger-addresses-saturated-fat-confusion-in-new-dvd/\" target=\"_blank\" rel=\"noopener\">volume 22</a> on NutritionFacts.org just ran out, so starting next month and running through April, I’ll be rolling out the videos from this new DVD, volume 23. The DVDs give folks the opportunity to sneak-preview videos months ahead of time, watch them all straight through, and share them as gifts, but there is nothing on the DVDs that won’t eventually end up free online here at NutritionFacts.org. If you’d like the works–40+ hours of video–you can get the <a style=\"color: #339900; font-weight: normal; text-decoration: underline;\" href=\"http://www.drgreger.org/downloads\" target=\"_self\" rel=\"noopener\">complete DVD collection</a>.</p>\n<p>Here’s the list of chapters from the new volume 23 DVD — a preview of what’s to come over the next few months on NutritionFacts.org:</p>\n<ol>\n<li>The Problem with the Paleo Diet Argument</li>\n<li>What Causes Insulin Resistance?</li>\n<li>The Spillover Effect Links Obesity to Diabetes</li>\n<li value=\"4\">Lipotoxicity: How Saturated Fat Raises Blood Sugar</li>\n<li value=\"5\">Plant-Based Workplace Intervention</li>\n<li value=\"6\">The Cilantro Gene</li>\n<li value=\"7\">Reducing Glycotoxin Intake to Prevent Alzheimers</li>\n<li value=\"8\">Optimal Cholesterol Level</li>\n<li value=\"9\">Preventing Ulcerative Colitis with Diet</li>\n<li value=\"10\">Stool pH and Colon Cancer</li>\n<li value=\"11\">Why Was Heart Disease Rare in the Mediterranean?</li>\n<li value=\"12\">The Mediterranean Diet or a Whole Food Plant-Based Diet?</li>\n<li value=\"13\">PREDIMED: Does Eating Nuts Prevent Strokes?</li>\n<li value=\"14\">Which Parts of the Mediterranean Diet Extended Life?</li>\n<li value=\"15\">Do Flexitarians Live Longer?</li>\n<li value=\"16\">Improving on the Mediterranean Diet</li>\n<li value=\"17\">Exercise vs. Drugs for Depression</li>\n<li value=\"18\">Do Antidepressant Drugs Really Work?</li>\n<li value=\"19\">Is Milk Good for Our Bones?</li>\n<li value=\"20\">If White Rice is Linked to Diabetes, What About China?</li>\n<li value=\"21\">Oatmeal Lotion for Chemotherapy-Induced Rash</li>\n<li value=\"22\">Can Oatmeal Help Fatty Liver Disease?</li>\n<li value=\"23\">Nutritional Yeast to Prevent the Common Cold</li>\n<li value=\"24\">ALS (Lou Gehrig’s Disease): Fishing for Answers</li>\n<li value=\"25\">Diet and Amyotrophic Lateral Sclerosis (ALS)</li>\n<li value=\"26\">How Much Fruit Is Too Much?</li>\n</ol>\n<p>Order my new DVD at <strong><a href=\"http://www.drgreger.org/dvds\" target=\"_blank\" rel=\"noopener\">DrGreger.org/dvds</a></strong> or <a href=\"http://smile.amazon.com/Latest-Clinical-Nutrition-Michael-Greger/dp/B00S73ZU48/&amp;tag=httpwwwdrgreg-20\" target=\"_blank\" rel=\"noopener\"><strong>through Amazon</strong></a>. It can also be ordered as a video download at <strong><a href=\"http://www.DrGreger.org/downloads\" target=\"_self\" rel=\"noopener\">DrGreger.org/downloads</a>.</strong><br/>\n </p>\n<div style=\"text-align: left;\"><span style=\"font-size: 18px;\"><strong>DVD Subscription</strong></span></div>\n<p>If you were a regular supporter, you’d already be a Mediterranean diet expert by now, having gotten the new DVD last week! I now come out with DVDs every 9 weeks. If you’d like to automatically receive them before they’re even available to the public, please consider becoming a monthly donor.</p>\n<p>Anyone signing up on the <a style=\"color: #339900; font-weight: normal; text-decoration: underline;\" href=\"https://nutritionfacts.org/donate/\" target=\"_self\" rel=\"noopener\">donation page</a> to become a $15 monthly contributor will receive the next three DVDs for free (as physical DVDs, downloads, or both–your choice), and anyone signing up as a $25 monthly contributor will get a whole year’s worth of new DVDs. If you’re already signed up and didn’t receive your volume 23 yet, please email Tommasina@NutritionFacts.org and she’ll make everything all better.</p>\n<p>If you’d rather just watch all the videos online as they launch, but would still like to support my work of helping to educate millions about healthy eating, you can make a tax-deductible donation to NutritionFacts.org <a style=\"color: #339900; font-weight: normal; text-decoration: underline;\" href=\"https://nutritionfacts.org/donate/\" target=\"_blank\" rel=\"noopener\">using a credit card</a>, a <a style=\"color: #339900; font-weight: normal; text-decoration: underline;\" href=\"https://www.paypal.com/cgi-bin/webscr?cmd=_s-xclick&amp;hosted_button_id=6SWYJD9SYAZHE\" target=\"_blank\" rel=\"noopener\">direct PayPal link</a>, or by sending a check to NutritionFacts.org 6800 Wisconsin Avenue #1185 Chevy Chase, MD 20815.</p>\n<p>In my next DVD I’ll dig into whether organic fruits and vegetables are safer and healthier enough to justify the extra cost–stay tuned!</p>\n<p><strong>-Michael Greger</strong></p>"
  }
}
