{
  "Title": "Plant-Based Is Not the Same as Vegetarianism",
  "Url": "https://nutritionfacts.org/blog/plant-based-is-not-the-same-as-vegetarianism/",
  "UpdatedAt": "2018-02-01T13:00:37+00:00",
  "Author": "Michael Greger M.D. FACLM",
  "CoverImage": {
    "Urls": [
      "https://assets.nutritionfacts.org/2018/02/Optimal-Diet-Just-Give-it-To-Me-Straight-1-960x540.jpeg",
      "https://assets.nutritionfacts.org/2018/02/Optimal-Diet-Just-Give-it-To-Me-Straight-1-768x432.jpeg",
      "https://assets.nutritionfacts.org/2018/02/Optimal-Diet-Just-Give-it-To-Me-Straight-1-1024x576.jpeg",
      "https://assets.nutritionfacts.org/2018/02/Optimal-Diet-Just-Give-it-To-Me-Straight-1-720x405.jpeg",
      "https://assets.nutritionfacts.org/2018/02/Optimal-Diet-Just-Give-it-To-Me-Straight-1-540x304.jpeg",
      "https://assets.nutritionfacts.org/2018/02/Optimal-Diet-Just-Give-it-To-Me-Straight-1-355x200.jpeg",
      "https://assets.nutritionfacts.org/2018/02/Optimal-Diet-Just-Give-it-To-Me-Straight-1-928x522.jpeg",
      "https://assets.nutritionfacts.org/2018/02/Optimal-Diet-Just-Give-it-To-Me-Straight-1-1200x675.jpeg"
    ],
    "Attribution": "Image Credit: Kristina DeMuth"
  },
  "Content": {
    "Html": "<p>Referring to heart disease, <a href=\"http://www.dresselstyn.com/site/about/about-dr-esselstyn/\">Dr. Caldwell B. Esselstyn, Jr., MD</a> asks, “Why is there reticence to provide the public with guidelines that will spare them this disease or its progression?” in an article <a href=\"http://www.ajconline.org/article/S0002-9149(98)00714-0/fulltext\">published</a> in <em>The American Journal of Cardiology</em>. “The National Research Council position was that a dietary fat recommendation lower than 30% would be too frustrating for those attempting to achieve a significant reduction. Although it is uncertain to what extent people will adopt the advice, it is nevertheless scientifically and ethically imperative to inform the public what constitutes an optimal diet. We must tell the public the truth about what is best for their health, and let them decide their degree of compliance,” he asserts.</p>\n<p>My video <a href=\"https://nutritionfacts.org/video/optimal-diet-just-give-it-to-me-straight-doc/\"><strong>Optimal Diet: Just Give It to Me Straight, Doc</strong></a> describes how Dr. Esselstyn challenged an expert panel to answer these questions from patients: “I’ll do anything, but I never want to have heart disease” and “I’ve had a heart attack, and I never want another.” Answers ranged from having them “eat beans, beans, and more beans” to it’s “time for the public to embrace a plant-based diet.”</p>\n<p>The recommended plant-based diet is not the same as vegetarianism. Vegetarians often consume all sorts of less-than-healthful foods, such as oils, margarine, dairy products, and eggs. Vegans do, too, for that matter. “This new paradigm is exclusively plant-based nutrition,” Dr. Esselstyn explains. In other words, it consists only of whole plant foods. Why exclusively? Because, as <a href=\"http://www.ajconline.org/article/S0002-9149(98)00718-8/pdf\">reported</a> in the <a href=\"http://www.cornell.edu/video/playlist/the-china-project-studying-the-link-between-diet-and-disease\">Cornell China Study</a>, there does not appear to be “a threshold beyond which further benefits do not accrue with increasing proportions of plant-based foods in the diet.” It appears the more plant-based foods and the fewer animal-based foods, the better.</p>\n<p>In a separate paper <a href=\"http://www.ajconline.org/article/S0002-9149(98)00715-2/pdf\">published</a> in <em>The American Journal of Cardiology</em>, Dr. Esselstyn acknowledges that he is “acutely aware of the castigation that accompanies recommending a plant-based diet—namely that the recommendation will be met with skepticism and hostility on the part of the general public”—though less so these days as millions jump on the plant-based wagon. But that hostility is “peculiar,” Dr. Esselstyn continues, “because many cultures sustain themselves with such a diet, enjoying its taste, texture, and variety, as well as its health-promoting qualities. However, dietary preference is deeply personal, and one can easily be offended. Nevertheless, the public has a right to know the truth as understood by experts in nutritive biology about what constitutes the safest and healthiest diet.”</p>\n<p>I couldn’t have said it better. The public has a right to know the truth.</p>\n<p>“Some criticize this exclusively plant-based diet as extreme or draconian. Webster’s dictionary defines draconian as ‘inhumanly cruel.’ A closer look reveals that ‘extreme’ or ‘inhumanly cruel’ describes not plant-based nutrition, but the consequences of our present Western diet,” Dr. Esselstyn writes, adding that having a breastbone sawed in half for bypass surgery or a stroke that renders one an invalid unable to speak “can be construed as extreme, and having a breast, prostate, colon, or rectum removed to treat cancer may seem inhumanly cruel.” <em>That’s</em> extreme.</p>\n<p>Eating a bean burrito is easy.</p>\n<hr/>\n<p>So what should the cholesterol guidelines be for the prevention of our number-one killer? The answer to that question can be found in my video <a href=\"https://nutritionfacts.org/video/everything-in-moderation-even-heart-disease/\"><strong>Everything in Moderation? Even Heart Disease?</strong></a><strong>. </strong>You can also learn at what age this information applies to you and your loved ones in my videos <a href=\"https://nutritionfacts.org/video/how-not-to-die-from-heart-disease/\"><strong>How Not to Die from Heart Disease</strong></a> and <a href=\"https://nutritionfacts.org/video/heart-disease-may-start-in-the-womb/\"><strong>Heart Disease May Start in the Womb</strong></a>.</p>\n<p>If you know someone who already has heart disease, be sure to also watch my video <a href=\"https://nutritionfacts.org/video/eliminating-90-of-heart-disease-risk/\"><strong>Eliminating 90% of Heart Disease Risk</strong></a>, in which I compare the effectiveness of pharmacological therapies against those of a plant-based diet.</p>\n<p>For more information on lifestyle approaches to chronic disease, which can sometimes be not only cheaper and safer but also more effective than pharmacological or surgical approaches, take a look at some of my other videos:</p>\n<ul>\n<li><a href=\"https://nutritionfacts.org/video/lifestyle-medicine-treating-the-causes-of-disease/\"><strong>Lifestyle Medicine: Treating the Causes of Disease</strong></a></li>\n<li><a href=\"https://nutritionfacts.org/video/convincing-doctors-to-embrace-lifestyle-medicine/\"><strong>Convincing Doctors to Embrace Lifestyle Medicine</strong></a></li>\n<li><a href=\"https://nutritionfacts.org/video/what-diet-should-physicians-recommend/\"><strong>What Diet Should Physicians Recommend?</strong></a></li>\n<li><a href=\"https://nutritionfacts.org/video/The-Actual-Benefit-of-Diet-vs-Drugs/\"><strong>The Actual Benefit of Diet vs. Drugs</strong></a></li>\n<li><a href=\"https://nutritionfacts.org/video/Why-Prevention-is-Worth-a-Ton-of-Cure/\"><strong>Why Prevention Is Worth a Ton of Cure</strong></a></li>\n<li><a href=\"https://nutritionfacts.org/video/physicians-may-be-missing-their-most-important-tool/\"><strong>Physicians May Be Missing Their Most Important Tool</strong></a></li>\n</ul>\n<p>In health,</p>\n<p><b>Michael Greger, M.D.</b></p>\n<p>PS: If you haven’t yet, you can subscribe to my free videos <a href=\"https://nutritionfacts.org/subscribe/\"><u><b>here</b></u></a><b> </b>and watch my live, year-in-review presentations:</p>\n<ul>\n<li>2012: <a href=\"https://nutritionfacts.org/video/uprooting-the-leading-causes-of-death/\"><u><b>Uprooting the Leading Causes of Death</b></u></a></li>\n<li>2013: <a href=\"https://nutritionfacts.org/video/more-than-an-apple-a-day-preventing-our-most-common-diseases/\"><u><b>More Than an Apple a Day</b></u></a></li>\n<li>2014: <a href=\"https://nutritionfacts.org/video/from-table-to-able/\"><u><b>From Table to Able: Combating Disabling Diseases with Food</b></u></a></li>\n<li>2015: <a href=\"https://nutritionfacts.org/video/food-as-medicine/\"><u><b>Food as Medicine: Preventing and Treating the Most Dreaded Diseases with Diet</b></u></a></li>\n<li>2016: <a href=\"https://nutritionfacts.org/video/how-not-to-die/\"><u><b>How Not To Die: The Role of Diet in Preventing, Arresting, and Reversing Our Top 15 Killers</b></u></a></li>\n</ul>"
  }
}
