{
  "Title": "Overdosing on Poppy Seeds",
  "Url": "https://nutritionfacts.org/blog/overdosing-on-poppy-seeds/",
  "UpdatedAt": "2014-09-11T12:00:42+00:00",
  "Author": "Michael Greger M.D. FACLM",
  "CoverImage": {
    "Urls": [
      "https://assets.nutritionfacts.org/2014/09/NF-Sep9-How-Many-Poppy-Seeds-Are-Too-Many-768x333.jpg",
      "https://assets.nutritionfacts.org/2014/09/NF-Sep9-How-Many-Poppy-Seeds-Are-Too-Many-320x139.jpg",
      "https://assets.nutritionfacts.org/2014/09/NF-Sep9-How-Many-Poppy-Seeds-Are-Too-Many.jpg",
      "https://assets.nutritionfacts.org/2014/09/NF-Sep9-How-Many-Poppy-Seeds-Are-Too-Many-300x130.jpg",
      "https://assets.nutritionfacts.org/2014/09/NF-Sep9-How-Many-Poppy-Seeds-Are-Too-Many-460x200.jpg",
      "https://assets.nutritionfacts.org/2014/09/NF-Sep9-How-Many-Poppy-Seeds-Are-Too-Many-800x347.jpg",
      "https://assets.nutritionfacts.org/2014/09/NF-Sep9-How-Many-Poppy-Seeds-Are-Too-Many-1024x445.jpg"
    ],
    "Attribution": "Image Credit: Kirsten Loza / Flickr.  This image has been modified."
  },
  "Content": {
    "Html": "<p>The opium poppy used to make heroin is the same opium poppy used to make muffins and bagels. Does this mean that poppy seed muffin we may have had for breakfast contained a powerful narcotic? The idea that poppy seeds could serve as the source of appreciable amounts of codeine/morphine was not <a href=\"http://www.ncbi.nlm.nih.gov/pubmed/3979930\" target=\"_blank\" rel=\"noopener\">given</a> much credence despite the existence of an old European custom recommending a poppy-seed-filled pacifier to quiet a noisy baby. It wasn’t given much credence, that is, <em>until</em> a mother <a href=\"http://www.bfr.bund.de/cm/364/cases_of_poisoning_reported_by_physicians_2005.pdf\" target=\"_blank\" rel=\"noopener\">tried</a> giving her six-month-old some strained milk she had boiled some poppy seeds in with the very best intentions of helping the child sleep better. It worked a little too well, culminating in respiratory arrest. Now we have <a href=\"http://www.bfr.bund.de/en/press_information/2005/12/poppy_seed_for_baking_is_not_a_soporific_for_infants-6282.html\" target=\"_blank\" rel=\"noopener\">governmental warnings</a> that such a practice is not a good idea.</p>\n<p>The cases aren’t limited to children. Evidently if we <a href=\"http://www.ncbi.nlm.nih.gov/pubmed/19901868\" target=\"_blank\" rel=\"noopener\">eat</a> spaghetti with a half cup of poppy seeds on top, it can make adults a little loopy as well.</p>\n<p>So what’s the upper limit of poppy seed consumption that’s probably safe? A study profiled in my video, <a href=\"https://nutritionfacts.org/video/how-many-poppy-seeds-are-too-many/\" target=\"_blank\" rel=\"noopener\"><strong>How Many Poppy Seeds is Too Many?</strong></a>, suggests about one teaspoon for every seven pounds of body weight. That means that someone weighing about 150 pounds (70 kilograms) should probably eat no more than seven tablespoons of raw poppy seeds at a time.</p>\n<p>Cooking may wipe out half of the morphine and codeine, though, so that gives us some more leeway when baking. Soaking the seeds for five minutes first and then discarding the water before adding them to our recipe can eliminate another half if we’re making some poppy seed filled pastry or something for kids. Otherwise, though, there shouldn’t be any risk at usual levels of intake—unless you’re going in for a drug test, in which case you may want to <a href=\"http://www.ncbi.nlm.nih.gov/pubmed/19901868\" target=\"_blank\" rel=\"noopener\">avoid</a> poppy seeds altogether.</p>\n<p>To learn more about not overdoing healthy foods check out these videos:</p>\n<ul>\n<li><strong><a href=\"https://nutritionfacts.org/video/overdosing-on-greens/\" target=\"_blank\" rel=\"noopener\">Overdosing on Greens</a></strong></li>\n<li><strong><a href=\"https://nutritionfacts.org/video/how-much-broccoli-is-too-much/\" target=\"_blank\" rel=\"noopener\">How Much Broccoli Is Too Much?</a></strong></li>\n<li><strong><a href=\"https://nutritionfacts.org/video/how-much-soy-is-too-much/\" target=\"_blank\" rel=\"noopener\">How Much Soy Is Too Much?</a></strong></li>\n</ul>\n<p><strong>-Michael Greger, M.D.</strong></p>\n<p>PS: If you haven’t yet, you can subscribe to my videos for free by <a href=\"https://nutritionfacts.us5.list-manage.com/subscribe?u=c1bae6687e1e6ab175fb56913&amp;id=40f9e497d1\" target=\"_blank\" rel=\"noopener\"><strong>clicking here</strong></a> and watch my full 2012 – 2015 presentations <strong><a href=\"https://nutritionfacts.org/video/uprooting-the-leading-causes-of-death/\" target=\"_blank\" rel=\"noopener\">Uprooting the Leading Causes of Death</a></strong>, <strong><a href=\"https://nutritionfacts.org/video/more-than-an-apple-a-day-preventing-our-most-common-diseases/\">More than an Apple a Day</a></strong>, <strong><a href=\"https://nutritionfacts.org/video/from-table-to-able/\">From Table to Able</a></strong>, and <strong><a href=\"https://nutritionfacts.org/video/food-as-medicine/\">Food as Medicine</a></strong>.</p>"
  }
}
