{
  "Title": "Berries to Prevent Muscle Soreness",
  "Url": "https://nutritionfacts.org/blog/berries-to-prevent-muscle-soreness/",
  "UpdatedAt": "2014-05-08T12:00:27+00:00",
  "Author": "Michael Greger M.D. FACLM",
  "CoverImage": {
    "Urls": [
      "https://assets.nutritionfacts.org/2014/05/NF-May6-Reducing-Muscle-Soreness-with-Berries.jpg",
      "https://assets.nutritionfacts.org/2014/05/NF-May6-Reducing-Muscle-Soreness-with-Berries-300x130.jpg",
      "https://assets.nutritionfacts.org/2014/05/NF-May6-Reducing-Muscle-Soreness-with-Berries-460x200.jpg",
      "https://assets.nutritionfacts.org/2014/05/NF-May6-Reducing-Muscle-Soreness-with-Berries-800x347.jpg",
      "https://assets.nutritionfacts.org/2014/05/NF-May6-Reducing-Muscle-Soreness-with-Berries-1024x444.jpg",
      "https://assets.nutritionfacts.org/2014/05/NF-May6-Reducing-Muscle-Soreness-with-Berries-768x333.jpg",
      "https://assets.nutritionfacts.org/2014/05/NF-May6-Reducing-Muscle-Soreness-with-Berries-320x139.jpg"
    ],
    "Attribution": "Image Credit: Gavin St. Ours / Flickr.  This image has been modified."
  },
  "Content": {
    "Html": "<p>The burning sensation during strenuous exercise may be related to the build-up of lactic acid in our muscles (see <a href=\"https://nutritionfacts.org/video/reducing-muscle-fatigue-with-citrus/\" target=\"_blank\" rel=\"noopener\" data-ls-seen=\"1\"><strong>Reducing Muscle Fatigue with Citrus</strong></a>), but that’s different than the delayed onset muscle soreness that occurs in the days following a bout of extreme physical activity. This post-exercise soreness is <a href=\"http://www.ncbi.nlm.nih.gov/pubmed/2072832\" target=\"_blank\" rel=\"noopener\">thought</a> to be due to inflammation caused by muscle cell damage (little micro-tears in the muscle).</p>\n<p>If it’s an inflammatory reaction, then might anti-inflammatory phytonutrients help? The bioflavonoids in citrus might help with the lactic acid buildup, but we may need to ramp up to the anthocyanin flavonoids in berries to deal with the inflammation.</p>\n<p>We know, for example, that if we eat about 45 cherries a day we can significantly <a href=\"http://www.ncbi.nlm.nih.gov/pubmed/16549461\" target=\"_blank\" rel=\"noopener\" data-ls-seen=\"1\">reduce</a> the levels of inflammatory markers like c-reactive protein in our bloodstream. Mushrooms (<strong><a title=\"Permanent link to Boosting Immunity While Reducing Inflammation\" href=\"https://nutritionfacts.org/video/boosting-immunity-while-reducing-inflammation/\" target=\"_blank\" rel=\"noopener\" data-ls-seen=\"1\">Boosting Immunity While Reducing Inflammation</a></strong>), nuts (<strong><a title=\"Permanent link to Fighting Inflammation in a Nut Shell\" href=\"https://nutritionfacts.org/video/fighting-inflammation-in-a-nut-shell/\" target=\"_blank\" rel=\"noopener\" data-ls-seen=\"1\">Fighting Inflammation in a Nut Shell</a></strong>), and purple potatoes (<strong><a title=\"Permanent link to Anti-Inflammatory Effects of Purple Potatoes\" href=\"https://nutritionfacts.org/video/anti-inflammatory-effects-of-purple-potatoes/\" target=\"_blank\" rel=\"noopener\" data-ls-seen=\"1\">Anti-Inflammatory Effects of Purple Potatoes</a></strong>) may also reduce inflammation (along with plant foods in general, see <a title=\"Permanent link to Anti-Inflammatory Antioxidants\" href=\"https://nutritionfacts.org/video/anti-inflammatory-antioxidants/\" target=\"_blank\" rel=\"noopener\" data-ls-seen=\"1\"><strong>Anti-Inflammatory Antioxidants</strong></a>) so much so that plant-based diets can be used to treat inflammatory conditions. See, for example, <strong><a title=\"Permanent link to Dietary Treatment of Crohn’s Disease\" href=\"https://nutritionfacts.org/video/achieving-remission-of-crohns-disease/\" target=\"_blank\" rel=\"noopener\" data-ls-seen=\"1\">Dietary Treatment of Crohn’s Disease</a></strong>, and <strong><a title=\"Permanent link to Potassium and Autoimmune Disease\" href=\"https://nutritionfacts.org/video/potassium-and-autoimmune-disease/\" target=\"_blank\" rel=\"noopener\" data-ls-seen=\"1\">Potassium and Autoimmune Disease</a></strong>. Animal products on the other hand, may increase inflammation through a variety of mechanisms, including endotoxins (<strong><a title=\"Permanent link to How Does Meat Cause Inflammation?\" href=\"https://nutritionfacts.org/2012/09/20/why-meat-causes-inflammation/\" target=\"_blank\" rel=\"noopener\" data-ls-seen=\"1\">How Does Meat Cause Inflammation?</a></strong>), arachidonic acid (<strong><a title=\"Permanent link to Chicken, Eggs, and Inflammation\" href=\"https://nutritionfacts.org/video/chicken-eggs-and-inflammation/\" target=\"_blank\" rel=\"noopener\" data-ls-seen=\"1\">Chicken, Eggs, and Inflammation</a></strong>), and Neu5Gc (<strong><a title=\"Permanent link to The Inflammatory Meat Molecule Neu5Gc\" href=\"https://nutritionfacts.org/video/the-inflammatory-meat-molecule-neu5gc/\" target=\"_blank\" rel=\"noopener\" data-ls-seen=\"1\">The Inflammatory Meat Molecule Neu5Gc</a></strong>).</p>\n<p>But what about reducing muscle soreness?</p>\n<p>Researchers <a href=\"http://www.ncbi.nlm.nih.gov/pubmed/16790484\" target=\"_blank\" rel=\"noopener\">took</a> some guys and made them flex their biceps against way too much weight over and over and over again, the next day the strength in their arms is way down—about a 30% drop—and they suffered serous soreness (See <a href=\"https://nutritionfacts.org/video/reducing-muscle-soreness-with-berries/\" target=\"_blank\" rel=\"noopener\"><strong>Reducing Muscle Soreness with Berries</strong></a>). But if they were drinking some cherry juice, their arms ended up hurting less and they were able to better preserve their strength. Why not just feed them cherries? Because we can’t do a placebo group since we can’t really create a convincing fake cherry, but we can make fake cherry juice in the form of cherry Kool-Aid.</p>\n<p>This was “the first <a href=\"http://www.ncbi.nlm.nih.gov/pubmed/16790484\" target=\"_blank\" rel=\"noopener\" data-ls-seen=\"1\">study</a> to examine the effect of the consumption of any cherry product on the symptoms of exercise induced muscle damage,” and it seemed to work. Follow-up <a href=\"http://www.ncbi.nlm.nih.gov/pubmed/16790484\" target=\"_blank\" rel=\"noopener\">studies</a> show it also works on <a href=\"http://www.ncbi.nlm.nih.gov/pubmed/19883392\" target=\"_blank\" rel=\"noopener\">reducing</a> muscle pain in long-distance runners, speeding recovery after a marathon, considered “the holy grail of exercise science.”</p>\n<p>A similar <a href=\"http://www.ncbi.nlm.nih.gov/pubmed/22111516\" target=\"_blank\" rel=\"noopener\">study</a> showing anti-inflammatory effects of eating blueberries took it a step further and actually paid athletes to take a muscle biopsy so they could see what’s happening to their muscles on a microscopic level. It’s like another <a href=\"http://www.ncbi.nlm.nih.gov/pubmed/22301554\" target=\"_blank\" rel=\"noopener\" data-ls-seen=\"1\">study</a> which showed how massage could decrease inflammation. At first I was like: “ooh, I wouldn’t mind being part of that study—free relaxing massage!” until I read the protocol: subjects got to rest a few minutes, then the scalpels come out and cut out some muscle samples. No thanks.</p>\n<p>And of course there are drugs—there are always drugs—but with drugs there are side effects. So the cherry study, as noted in an editorial comment, “may provide more of a sensible and realistic treatment option for those suffering from sore and damaged muscles. The scientific question of how to treat the damaged muscle is an important one, and these researchers should be applauded for finding a potential treatment that is not only practical, but one that can be enjoyed.”</p>\n<p>How about improving athletic performance more directly? See my video series on performance-enhancing vegetables described in my blog <strong><a title=\"Permanent link to Using Greens to Improve Athletic Performance\" href=\"https://nutritionfacts.org/2012/03/22/using-greens-to-improve-athletic-performance/\" target=\"_blank\" rel=\"noopener\" data-ls-seen=\"1\">Using Greens to Improve Athletic Performance</a></strong>.</p>\n<p><strong>-Michael Greger, M.D.</strong></p>\n<p>PS: If you haven’t yet, you can subscribe to my videos for free by <a href=\"https://nutritionfacts.us5.list-manage.com/subscribe?u=c1bae6687e1e6ab175fb56913&amp;id=40f9e497d1\" target=\"_blank\" rel=\"noopener\"><strong>clicking here</strong></a> and watch my full 2012 – 2015 presentations <strong><a href=\"https://nutritionfacts.org/video/uprooting-the-leading-causes-of-death/\" target=\"_blank\" rel=\"noopener\">Uprooting the Leading Causes of Death</a></strong>, <strong><a href=\"https://nutritionfacts.org/video/more-than-an-apple-a-day-preventing-our-most-common-diseases/\">More than an Apple a Day</a></strong>, <strong><a href=\"https://nutritionfacts.org/video/from-table-to-able/\">From Table to Able</a></strong>, and <strong><a href=\"https://nutritionfacts.org/video/food-as-medicine/\">Food as Medicine</a></strong>.</p>"
  }
}
